name,titleH1,body1Title,body1Text,body2Title,body2Text,body3Title,body3Text,body4Title,body4Text,FAQTitle,FAQQuest1,FAQAnswer1,FAQQuest2,FAQAnswer2,FAQQuest3,FAQAnswer3,,,
guadeloupe,Lorem ipsum,<h2>Voyage en Guadeloupe : pourquoi opter pour une location de voiture ?</h2>,"<p>Vous partez bientôt en Guadeloupe et vous vous interrogez sur les différentes options de transport pour vos déplacements sur l'île ? Pensez à la location de voiture ! </p>
<p>Louer une voiture est en effet probablement le meilleur moyen de visiter la Guadeloupe car les transports en commun, et notamment les bus, ne sont pas toujours très ponctuels et ne fonctionnent pas tous les jours de la semaine. En louant un véhicule pour votre séjour, vous serez aisi plus libre de vos mouvements et pourrez organiser vos activités comme bon vous semble. </p>
<p>Au-delà de son côté pratique, la location de voiture est également une option économique, en particulier si vous voyagez à plusieurs. Il est en effet possible de trouver des offres de location autour de 30 ou 40 € par jour et l'essence est généralement à peine plus chère qu'en métropole. Pour profiter de tarifs intéressants, il vous suffira par ailleurs de réserver votre véhicule à l'avance.</p>",<h2>Comment louer une voiture en Guadeloupe ?</h2>,"<p>Si vous atterrissez à l’aéroport Guadeloupe - Pôle Caraïbes de Pointe-à-Pitre, vous pourrez louer une voiture dès votre arrivée auprès de l'une des agences de location présentes à l'aéroport. Une dizaine de loueurs de renommée internationale et notamment Hertz, Sixt et Europcar vous attendent en effet dans un bâtiment annexe situé à proximité de l’aérogare Nord. </p>
<p>Si vous ne souhaitez pas louer directement votre véhicule à l’aéroport, vous pourrez également le faire au centre de Pointe-à-Pitre mais il faudra alors prendre le bus ou un taxi pour rejoindre le centre-ville. Une fois sur place, vous trouverez les bureaux de plusieurs agences de location de voitures près de la gare maritime ou dans l'hypercentre. </p>
<p>En dehors de Pointe-à-Pitre, vous trouverez également des agences de location dans la plupart des grandes villes de la Guadeloupe et notamment à Sainte-Anne, à Saint François, au Gosier, mais aussi à Sainte-Rose ou à Saint-Charles. </p>
<p>Pour gagner du temps à votre arrivée et profiter des meilleurs tarifs, nous vous recommandons tout de même de réserver votre location de voiture à l'avance, en faisant appel au moteur de recherche d'eDreams. </p>",<h2>Que visiter en Guadeloupe ? </h2>,"<p>Si vous arrivez en Guadeloupe par sa capitale Pointe-à-Pitre, prenez le temps de découvrir cette ville haute en couleurs ! Vous y découvrirez en effet de jolies ruelles animées, des marchés caribéens colorés, ainsi qu'un riche patrimoine architectural et culturel. </p>
<p>Poursuivez votre découverte de l'île de Grande-Terre par ses superbes plages paradisiaques. Ne manquez par exemple pas de vous rendre sur la Pointe des châteaux, une magnifique péninsule à l'extrême est de l'île, et de profiter de la vue panoramique. Nous vous recommandons également de faire un tour par les plages de Bois Jolan et de la Datcha. Parmi les villes à visiter à Grande-Terre, nous vous conseillons tout particulièrement Sainte-Anne et Saint-François. </p>
<p>Une fois sur l'île de Basse-Terre, rendez-vous dans le charmant village de pêcheurs de Deshaies. Vous y découvrirez de nombreuses maisons de style caraïbe ainsi qu'un très joli jardin botanique. Non loin de là, ne manquez pas la plage de Grande-Anse, bordée de cocotiers, qui est sans aucun doute l'une des plus belles de l'île. Vous pourrez ensuite vous rendre dans la ville de Basse-Terre et découvrir son agréable marché. Enfin, ne quittez pas l'île sans vous être rendu aux chutes du Carbet et avoir grimpé sur le volcan de la Grande Soufrière.</p>
<p>Si vous avez le temps, nous ne pouvons que vous recommander de découvrir les îles secondaires de l'archipel et notamment la magnifique île de Marie-Galante ainsi que l'archipel des Saintes. </p>",<h2>Conduire en Guadeloupe : ce qu'il faut savoir</h2>,"<p>En Guadeloupe, l'état des routes est généralement plus que convenable mais il faut tout de même vous attendre à trouver quelques nids de poule sur les petites routes peu fréquentées. Il est par ailleurs très facile de se rendre d'une île à l'autre car elles sont reliées par un pont. Sachez tout de même que les embouteillages sont fréquents sur plusieurs axes du réseau routier guadeloupéen, en particulier aux heures de pointe. </p>
<p>Bien que cela puisse sembler évident, le code de la route et les limitations de vitesse sont les mêmes qu'en métropole. Notez toutefois que pour louer une voiture en Guadeloupe, vous devrez être âgé de 21 ans au minimum et avoir votre permis depuis plus d’un an.</p>
<p>Pour finir, quelques conseils pratiques : évitez de laisser des objets de valeur dans votre voiture de location et ne vous garez pas sous un cocotier ! </p>",<h2>Louer une voiture en Guadeloupe : les questions les plus fréquentes</h2>,<h3>Où puis-je trouver des agences de location de voitures en Guadeloupe ?</h3>,"<p>Pour louer une voiture en Guadeloupe vous pourrez évidemment vous adresser à une agence de location de voitures sur place, soit en ville, soit à l'aéroport. De nombreux hôtels proposent également un service de location de véhicules à leurs clients. Pour bénéficier des meilleurs tarifs, nous vous conseillons toutefois de réserver votre location à l'avance, en utilisant, par exemple, le moteur de recherche d'eDreams.  </p>",<h3>Quel est le prix moyen d'une location de voiture en Guadeloupe ?</h3>,"<p>Les prix des locations de voiture varient en fonction des agences, de la catégorie du véhicule et des prestations souhaitées mais il faut généralement compter autour de 30 ou 40 € par jour avec kilométrage illimité. Il faut par ailleurs savoir que certains loueurs ajoutent parfois une surcharge d'environ 25 € pour les voitures louées directement à l'aéroport. </p>",<h3>Quel type de véhicule louer sur eDreams pour mon séjour en Guadeloupe ? </h3>,"<p>Le moteur de recherche d'eDreams vous permet de choisir différentes catégories de locations de voiture pour votre séjour en Guadeloupe et notamment : mini, compacte, SUV, cabriolet, ou encore, minivan. Pour faire votre choix, nous vous conseillons de prendre en compte le volume de vos bagages mais aussi les itinéraires que vous envisagez : les routes escarpées de Basse-Terre n'ont en effet rien à voir avec les routes plates de Grande-Terre !</p>",ok,1001,https://www.edreams.fr/location-voiture/guadeloupe/
martinique,Lorem ipsum,<h2>Voyage en Martinique : pourquoi opter pour une location de voiture ?</h2>,"<p>Vous partez bientôt en Martinique et vous envisagez de louer une voiture sur place ? C'est une excellente idée ! </p>
<p>Si vous ne souhaitez pas passer votre temps à attendre des taxis ou à faire du stop, la location de voiture s'avère en effet être un excellent choix pour votre séjour en Martinique. Vous pourrez ainsi visiter l'île et découvrir la diversité des paysages martiniquais en toute liberté ! </p>
<p>Pratique, la location de voiture en Martinique est également économique puisque la plupart des grandes agences proposent des véhicules à partir de 30 ou 40 € par jour. En réservant votre voiture à l'avance vous pouvez également faire d'importantes économies. Si vous voyagez à plusieurs, c'est donc une solution tout à fait abordable. </p>",<h2>Comment louer une voiture en Martinique ?</h2>,"<p>Si vous le souhaitez, vous pourrez louer une voiture dès votre arrivée sur l'île, directement à l'aéroport international de Martinique-Aimé-Césaire. Une dizaine d'agences telles que Sixt, Avis, Hertz ou Budget vous attendent en effet dès votre descente de l'avion pour vous fournir le véhicule de votre choix. Vous ne perdrez ainsi pas de temps et pourrez immédiatement vous rendre dans la ville de votre choix. </p>
<p>La ville de Fort-de-France abrite également plusieurs agences de location de voiture, de même que la plupart des villes de l'île. Vous trouverez en effet des loueurs de voiture à Sainte-Anne, au Robert, aux Trois-Îlets, ou encore, au Lamentin. </p>
<p>Pour gagner du temps et profitez des meilleurs tarifs possibles pour votre location, nous vous recommandons toutefois d'effectuer votre réservation à l'avance grâce au moteur de recherche d'eDreams. Il vous suffira pour cela d'indiquer la période de location désirée, votre lieu de prise en charge et la tranche d'âge du conducteur principal. Vous accéderez ensuite aux offres des différents fournisseurs et pourrez finaliser votre réservation en quelques minutes seulement. </p>",<h2>Que visiter en Martinique ? </h2>,"<p>Vous arriverez certainement sur l'île de la Martinique par sa capitale, Fort-de-France, la seule grande ville de l’île. Située sur la côte ouest de la Martinique, elle fait face à une superbe baie et mérite que vous lui consacriez au moins une journée. Vous y découvrirez de jolis monuments dont la cathédrale Saint-Louis de Fort-de-France, la bibliothèque Schœlcher, ou encore, la statue de l'impératrice Joséphine, et pourrez visiter plusieurs musées d'intérêt. Ne manquez pas également de vous promener dans le grand marché couvert de Fort-de-France où les couleurs et les parfums vous feront découvrir le terroir local.</p>
<p>Située à 31 km au nord de Fort-de-France, nous vous conseillons également de visiter Saint-Pierre, une agréable commune au pied de la Montagne Pelée. Vous pourrez en visiter le centre-ville et la superbe baie, puis prévoir une randonnée sur la Montagne Pelée. Plusieurs itinéraires aménagés sont en effet disponibles mais il faut savoir que l'ascension est particulièrement rude et que les refuges qui permettent de passer la nuit en bivouac offrent des conditions relativement austères. </p>
<p>Rendez-vous ensuite à Grand-Rivière, un charmant village de pêcheurs situé sur la pointe nord de la Martinique. La route pour y accéder est tout simplement magnifique, et vous offrira une plongée exceptionnelle dans la nature sauvage de l'île, entre ravines et forêt profonde. </p>
<p>Côté plages, ne manquez pas celle des Salines, située sur la commune de Sainte-Anne. En plus d'être la plus belle de l'île, c'est également l’une des plus grandes des Caraïbes ! L'Anse Trabaud, les Fonds-Blancs et l'Anse Dufour font également partie des plages paradisiaques que compte la Martinique et méritent le détour. </p>",<h2>Conduire en Martinique : ce qu'il faut savoir</h2>,"<p>En Martinique, le réseau routier est plutôt bien entretenu mais il réserve tout de même des surprises. Il est en effet fréquent qu'une double voie se resserre en plein virage ou qu'une route de montagne ne soit pas suffisamment large pour laisser passer deux véhicules. La signalisation est également parfois manquante. Pour éviter les mauvaises surprises, nous ne pouvons donc que vous conseiller d'anticiper et de respecter scrupuleusement les limitations de vitesse. </p>
<p>Il faut également mentionner que les embouteillages sont importants, notamment aux abords de Fort-de-France et de Sainte-Anne, en particulier aux heures de pointe. Si vous souhaitez rejoindre le sud depuis Fort-de-France, ou inversement, n'hésitez donc pas à regarder les navettes maritimes qui vous permettront de gagner un peu de temps.</p>
<p>Notez enfin que les règles de conduite en Martinique sont les même que celles appliquées en France Métropolitaine.</p>",<h2>Louer une voiture en Martinique : les questions les plus fréquentes</h2>,<h3>Où puis-je trouver des agences de location de voitures en Martinique ?</h3>,"<p>Vous trouverez des agences de location de voiture à l'aéroport de Fort-de-France ainsi que dans d'autres villes de l'île comme Sainte-Luce, Schoelcher, Sainte-Anne, au Diamant, aux Trois-Ilets, ou au Lamentin. Toutefois, pour profiter des meilleurs tarifs possibles et vous assurer de la disponibilité du modèle que vous souhaitez, mieux vaut réserver votre voiture de location à l'avance grâce au moteur de recherche d'eDreams.</p>",<h3>Quel est le prix moyen d'une location de voiture en Martinique ?</h3>,"<p>Il est difficile de donner un prix moyen pour les voitures de location en Martinique car ils dépendent de différents facteurs comme la période, la catégorie de véhicule choisie ou les services inclus. Toutefois, les grosses agences proposent généralement des véhicules basiques pour environ 30 à 40 € par jour, kilométrage illimité.</p>",<h3>Quel type de véhicule louer sur eDreams pour mon séjour en Martinique ? </h3>,"<p>En réservant votre location de voiture sur eDreams, vous pourrez opter pour différentes catégories de véhicules pour votre séjour en Martinique (SUV, cabriolet, compacte, minivan, etc). Pour faire votre choix, nous vous conseillons de penser au nombre de passagers et au volume de bagages mais aussi à votre itinéraire sur l'île : allez-vous vous aventurer sur les routes de montagnes ou allez-vous rester sur le littoral ? </p>",ok,968,https://www.edreams.fr/location-voiture/martinique/
portugal,Lorem ipsum,<h2>Voyage au Portugal : pourquoi opter pour une location de voiture ?</h2>,"<p>Si vous avez prévu de découvrir le Portugal lors de vos prochaines vacances, pourquoi ne pas louer une voiture et opter pour un road-trip ? En longeant la côte, vous pourrez ainsi découvrir certains des plus beaux paysages du pays ainsi que les fantastiques villes de Porto, Lisbonne, Setúbal, ou encore Faro. Le Portugal se prête en effet très bien aux road-trips et la plupart des routes sont en bonnes conditions.​</p>
<p>Louer une voiture au Portugal vous permettra par ailleurs d'être pleinement maître de votre itinéraire et de ne pas perdre de temps à attendre les transports en commun. Vous pourrez ainsi facilement changer d'avis en cours de route et pourrez découvrir des lieux que vous n'auriez pas forcément visité si vous aviez choisi de vous déplacer en bus ou en train par exemple. </p>
<p>Enfin, il faut savoir que les locations de voiture au Portugal sont très économiques, en particulier si vous vous y prenez à l'avance, et vous permettront donc également de faire des économies, en particulier si vous voyagez à plusieurs.</p>",<h2>Comment louer une voiture au Portugal ?</h2>,"<p>Si vous vous rendez au Portugal en avion, vous aurez la possibilité de louer une voiture dès votre arrivée, à l'aéroport Humberto Delgado de Lisbonne, à l'aéroport de Porto-Francisco Sá-Carneiro, ou encore, à l'aéroport de Faro. Vous y trouverez en effet les principales agences de location de voiture d'Europe et notamment Sixt, Hertz, ou Europcar. </p>
<p>Si vous envisagez de visiter d'abord la ville où vous atterrissez puis de commencer votre road-trip quelques jours plus tard, vous pouvez également choisir de louer un véhicule dans une agence située en ville. La plupart des villes du Portugal abritent en effet des comptoirs de loueurs de voiture. </p>
<p>Enfin, pour ne pas perdre de temps à votre arrivée au Portugal et profiter des meilleures offres de location de voitures, vous pouvez aussi réserver votre véhicule à l'avance, en passant par le moteur de recherche d'eDreams. </p>",<h2>Que visiter au Portugal ? </h2>,"<p>Si vous passez un peu de temps au Portugal, ne manquez pas de visiter sa capitale, Lisbonne. Vous découvrirez ainsi une ville charmante, dotée d'un patrimoine architectural exceptionnel et de nombreuses institutions culturelles. Ne manquez pas de vous promener dans le très agréable quartier de l'Alfama, considéré comme le plus authentique de la capitale. Visitez également les plus beaux monuments de la ville et notamment la Tour de Belem, le Monastère des Hiéronymites, le Château Saint-Georges, ainsi que ses superbes musées.</p>
<p>Non loin de là, vous pourrez aussi visiter la superbe ville de Sintra, classée au patrimoine mondial de l'UNESCO. Vous y découvrirez des châteaux perchés, d'incroyables palais et des ""quintas"" dans un cadre naturel absolument superbe. A 130 km au nord, vous pourrez également vous rendre à Nazaré, un port de pêche particulièrement charmant et authentique.  </p>
<p>Nous vous conseillons également de consacrer quelques jours à Porto, la deuxième ville du pays. Vous pourrez ainsi approfondir vos connaissances sur le célèbre vin produit localement, découvrir de superbes édifices ornés d’azulejos et monter à bord des incontournables tramways jaunes. </p>
<p>Dans le sud du pays, ne manquez pas également de vous arrêter dans le Parc naturel du Sud-Ouest Alentejano et Costa Vicentina, un lieu exceptionnel où vous pourrez admirer une faune abondante et de superbes paysages. Enfin, à l'extrême sud, les villes de Lagos et Faro en Algarve sont également d'excellentes destinations pour profiter de la plage et de la délicieuse gastronomie locale. </p>",<h2>Conduire au Portugal : ce qu'il faut savoir</h2>,"<p>Les routes portugaises sont généralement bien entretenues et il n’y a pas de différence radicale entre la conduite au Portugal et en France. Nous vous conseillons tout de même d'être prudent, en particulier si vous vous aventurez dans les villages ou les petites villes du pays. </p>
<p>Sachez par ailleurs que même si l'âge légal pour conduire au Portugal est de 18 ans, l’âge minimum pour pouvoir louer une voiture est de 23 ans, voire parfois même 25 ans chez certains loueurs. </p>
<p>Notez enfin que la limite de vitesse en zone urbaine est, en règle générale, de 50 km/h, tandis qu'elle est de 90 km/h sur les routes nationales et de 120 km/h sur les autoroutes. Les radars sont fréquents. </p>",<h2>Louer une voiture au Portugal : les questions les plus fréquentes</h2>,<h3>Où puis-je trouver des agences de location de voitures au Portugal ?</h3>,"<p>La plupart des aéroports du pays, et notamment l’aéroport Humberto Delgado de Lisbonne ainsi que ceux de Porto ou de Faro, abritent des comptoirs de loueurs de voiture. Si vous le souhaitez, vous pourrez donc louer une voiture dès votre arrivée dans le pays. Vous pourrez également trouver des agences de location dans la plupart des grandes villes du pays. Toutefois, pour éviter de perdre du temps et profiter de tarifs avantageux, vous avez tout intérêt à réserver votre véhicule de location à l'avance, grâce au moteur de recherche d'eDreams. </p>",<h3>Quel est le prix moyen d'une location de voiture au Portugal ?</h3>,"<p>Le prix de votre location de voiture au Portugal dépendra avant tout du type de véhicule choisi, des équipements demandés (GPS, siège bébé, rehausseur enfant, etc), mais aussi de la période de l'année. Pour des prestations basiques, sachez tout de même que vous pourrez louer une voiture pour une dizaine d'euros par jour. </p>",<h3>Quel type de véhicule louer sur eDreams pour mon séjour au Portugal ? </h3>,"<p>Grâce au moteur de recherche de location de voiture d'eDreams, vous pourrez choisir parmi différentes catégories de véhicules. Pour votre road-trip au Portugal, vous pouvez sans problème opter pour une voiture de type citadine ou compacte car les routes sont bonnes, en particulier sur le littoral. Pensez tout de même à vérifier si vous pouvez voyager de manière confortable avec vos passagers et vos bagages dans ce type de véhicule. </p>",ok,973,https://www.edreams.fr/location-voiture/portugal/
paris,Lorem ipsum,<h2>Voyage à Paris : pourquoi opter pour une location de voiture ?</h2>,"<p>Louer une voiture pour visiter Paris ? Mais oui, c'est une excellente idée ! </p>
<p>Bien que les transports en communs parisiens fonctionnent plutôt bien en règle générale, louer une voiture est un excellent moyen de découvrir la capitale française en toute liberté. Vous pourrez ainsi vous déplacer à votre guise dans les différents arrondissements de Paris, sans avoir à mémoriser les lignes et arrêts du métro, et n'aurez pas besoin de garder un oeil sur votre montre pour espérer attraper le dernier train. Visiter Paris en voiture de location vous permettra également de découvrir ses routes, ses avenues et ses boulevards sous un autre angle et de vous mêler aux parisiens dans leur quotidien. </p>
<p>Si vous envisagez de vous déplacer en Ile de France, et de découvrir par exemple le château de Versailles ou le parc de Disneyland Paris, ou de rejoindre les célèbres stations balnéaires normandes, une voiture de location vous sera également très utile. </p>",<h2>Comment louer une voiture à Paris ?</h2>,"<p>Si vous vous rendez à Paris en avion ou en train, vous aurez la possibilité de louer une voiture dès votre arrivée. Les aéroports de Roissy Charles de Gaulle, d'Orly et de Beauvais abritent en effet des comptoirs des plus grands loueurs de voiture européens. De même, les gares Saint-Lazare, du Nord, de Lyon, de l'Est, Montparnasse, de Bercy et de Massy, sont, elles aussi, équipées de comptoirs vous permettant de louer un véhicule. </p>
<p>Si vous souhaitez passer quelques jours à Paris avant de louer une voiture pour explorer la région ou rejoindre une autre destination, vous pourrez également choisir de vous adresser à une agence de location située en ville. Vous en trouverez en effet des dizaines, un peu partout dans la ville. </p>
<p>Enfin, pour éviter de perdre du temps lors de votre séjour à Paris et pour bénéficier du meilleur prix, vous pouvez aussi choisir de réserver votre location de voiture à l'avance, grâce au moteur de recherche d'eDreams. Très simple à utiliser, il vous permettra de comparer les offres des plus grandes agences européennes afin de trouver celle qui s'adapte le mieux à vos besoins. </p>",<h2>Que visiter à Paris ? </h2>,"<p>Un séjour à Paris vous permettra de (re)découvrir certains des monuments les plus visités au monde et notamment le musée du Louvre, la Tour Eiffel et la cathédrale Notre-Dame. Si vous aimez l'art, vous pourrez également profiter de votre passage dans la capitale pour vous rendre au musée d'Orsay, au musée de l'Orangerie ou au superbe musée Marmottan Monet. </p>
<p>Parmi les quartiers à ne pas manquer, nous vous conseillons évidemment de prévoir une balade à Montmartre afin de découvrir son charme suranné et sa superbe basilique du Sacré-Cœur, dans le Marais, pour profiter de son offre culturelle et de ses jolies boutiques branchées, mais aussi à Belleville dont le parc vous permettra de profiter d'une vue imprenable sur le tout Paris. </p>
<p>Si vous avez un peu de temps devant vous, profitez d'être véhiculé pour découvrir d'autres sites de la région et notamment l'impressionnant Château de Versailles et ses magnifiques jardins, ou le château de Saint-Germain en Laye, ancienne résidence des rois de France qui abrite aujourd'hui le Musée d'Archéologie National. Si vous voyagez avec des enfants, vous pourrez également vous rendre à Disneyland Paris ou au parc zoologique de Thoiry où vous pourrez réaliser un safari de plusieurs kilomètres au milieu de la faune africaine et nord-américaine.</p>",<h2>Conduire à Paris : ce qu'il faut savoir</h2>,"<p>Si le périphérique parisien est connu pour ses embouteillages, en particulier aux heures de pointe, les rues du centre, elles, sont généralement plus tranquilles et vous n'aurez aucun mal à vous déplacer, même en pleine journée. Sachez toutefois qu'il est très compliqué de se garer dans la capitale de la France et que certains visiteurs préfèrent carrément laisser leur véhicule dans l'un des grands parkings situés aux entrées de la ville puis prendre les transports en commun. </p>
<p>Parmi les particularités du périphérique, il faut savoir que la vitesse y est limitée à 70 km/h (contre 50 km/h en ville) et que les véhicules entrant par la droite ont priorité sur ceux qui circulent déjà. Il faut également faire très attention aux remontées de fil par les motards et toujours garder un oeil sur ses rétros !</p>",<h2>Louer une voiture à Paris : les questions les plus fréquentes</h2>,<h3>Où puis-je trouver des agences de location de voitures à Paris ?</h3>,"<p>Vous trouverez des agences de location de voiture dans tous les aéroports parisiens, mais aussi dans un grand nombre de gares de la capitale. La plupart des grands loueurs possèdent également des agences un peu partout dans Paris. Toutefois, si vous souhaitez gagner du temps et bénéficier de tarifs avantageux pour votre location, pensez à réserver votre voiture de location à l'avance grâce au comparateur d'eDreams. </p>",<h3>Quel est le prix moyen d'une location de voiture à Paris ?</h3>,"<p>Bien que le tarif d'une location de voiture dépende de plusieurs facteurs et notamment le modèle de véhicule choisi, la période de l'année, les services additionnels nécessaires, ou le lieu de prise en charge, vous pourrez trouver des locations de voiture à Paris autour de 20€ par jour en vous y prenant à l'avance. </p>",<h3>Quel type de véhicule louer sur eDreams pour mon séjour à Paris ? </h3>,"<p>Si vous recherchez votre location de voiture sur eDreams, vous aurez la possibilité de choisir entre différentes catégories de véhicules allant de la ""mini"" au minivan 9 places, en passant par la SUV, la compacte ou le cabriolet. Pour votre séjour à Paris, nous vous conseillons toutefois d'opter pour une petite citadine facile à garer car les places de parking ne sont pas toujours très larges. Evidemment, si vous voyagez en famille ou que vos bagages sont volumineux, vous devrez opter pour un modèle plus grand ! </p>",ok,981,https://www.edreams.fr/location-voiture/paris/
