name,titleH1,body1Title,body1Text,body2Title,body2Text,body3Title,body3Text,body4Title,body4Text,FAQTitle,FAQQuest1,FAQAnswer1,FAQQuest2,FAQAnswer2,FAQQuest3,FAQAnswer3,,,
marseille,Lorem ipsum,<h2>Voyage à Marseille : pourquoi opter pour une location de voiture ?</h2>,"<p>Vous avez prévu de vous rendre prochainement à Marseille et vous hésitez à louer une voiture sur place ? C'est pourtant une très bonne idée ! </p>
<p>Il faut en effet savoir que le réseau de transports en commun marseillais est assez limité. Les lignes de tram et de métro sont peu étendues et il vous faudra compter sur les bus pour rejoindre les zones excentrées, comme c'est notamment le cas du très agréable quartier de Pointe-Rouge ou du petit port des Goudes. En louant une voiture pour votre séjour à Marseille vous profiterez donc d'une grande liberté de mouvement et n'aurez pas à mémoriser les cartes des transports en commun ni à connaître les horaires de passage des trains...</p>
<p>Louer une voiture à Marseille vous permettra par ailleurs de découvrir d'autres sites touristiques de la région, et notamment, la charmante ville d’Aix-en-Provence, située à une trentaine de kilomètres de là, Cassis et ses fameuses calanques, ou encore, le superbe massif des Alpilles et ses villes emblématiques : Saint-Rémy-de-Provence et les Baux-de-Provence. </p>",<h2>Comment louer une voiture à Marseille ?</h2>,"<p>Si vous vous rendez à Marseille en avion ou en train, vous pourrez louer une voiture dès votre arrivée. Située sur la commune de Marignane, l'aéroport de Marseille Provence abrite en effet de nombreux guichets d'accueil pour louer une voiture au niveau des parkings devant le terminal 1. De son côté, la gare Saint-Charles, accueille, elle aussi, des comptoirs d'agences de location de voiture au niveau de l'entrée du parking P2, accès par le boulevard Voltaire. </p>
<p>Si vous le préférez, vous pourrez également trouver plusieurs agences pour louer une voiture en ville mais nous vous conseillons tout de même de réserver votre véhicule à l'avance sur eDreams afin de profiter des meilleurs tarifs et de vous assurer de la disponibilité du modèle que vous souhaitez. Il vous suffira pour cela de lancer une recherche en indiquant les dates de prise en charge et de retour du véhicule, le lieu de prise en charge, puis de vous laisser guider parmi les offres de location de voitures répertoriées par eDreams.   </p>",<h2>Que visiter à Marseille ? </h2>,"<p>Commencez votre découverte de la cité phocéenne par le Vieux-Port, l'âme de Marseille. Vous pourrez y admirer de très beaux monuments locaux comme le fort Saint-Nicolas ou, surplombant la ville, l'incontournable basilique de Notre-Dame-de-la-Garde. Le Vieux-Port est aussi l'endroit idéal pour prendre un café sur une terrasse au bord de l'eau ou goûter aux spécialités locales. De nombreux restaurants de poisson et fruits de mer proposent en effet des bouillabaisses et bourrides, ainsi que d'autres délicieux plats aux accents méditerranéens. </p>
<p>Promenez-vous également dans le quartier du Panier, certainement le plus authentique de la ville. Vous y découvrirez un dédale de ruelles et de jolies petites places ensoleillées, ainsi que plusieurs monuments à ne pas manquer comme par exemple le préau des Accoules, la Vieille Charité et l'Hôtel-Dieu. </p>
<p>Si vous souhaitez faire du shopping vous pourrez ensuite remonter la Cannebière et vous promener sur la rue Paradis ou la rue Saint-Ferréol. Ces deux grandes artères abritent en effet un nombre exceptionnel de boutiques en tout genre ! </p>
<p>Côté musées, ne manquez pas l'excellent Musée des civilisations de l’Europe et de la Méditerranée (MuCEM) situé sur le Vieux-Port ainsi que le Musée des Beaux-Arts de Marseille, intallé dans une aile du Palais Longchamps. </p>
<p>Enfin, ne quittez pas la ville sans avoir pris le temps de découvrir ses belles plages et ses emblématiques calanques. Typiques de la région, ces paysages sont tout simplement magnifiques. </p>",<h2>Conduire à Marseille : ce qu'il faut savoir</h2>,"<p>Si louer une voiture est sans aucun doute le meilleur moyen de visiter Marseille, il faut également savoir que la conduite n'y est pas toujours aisée en raison du trafic dense, en particulier aux heures de pointe. Les autoroutes sont en effet les principales voies d'accès à la ville, qui, contrairement à Paris, ne possède pas de périphérique et elles ont tendance à être congestionnées...</p>
<p>Il est également important de noter qu'il est difficile de se garer dans le centre-ville de Marseille. Vous risquez donc de passer beaucoup de temps à chercher une place ou devoir dépenser vos économies dans les parkings payants. Une bonne solution pour éviter ce type de problèmes est de choisir un hôtel disposant d'un parking pour les clients. </p>",<h2>Louer une voiture à Marseille : les questions les plus fréquentes</h2>,<h3>Où puis-je trouver des agences de location de voitures à Marseille ?</h3>,"<p>Vous trouverez des agences de location de voiture à l'aéroport de Marseille Provence, à la gare Saint-Charles, mais aussi dans plusieurs endroits de la ville. Cependant, pour gagner du temps et profiter de tarifs avantageux pour votre véhicule de location, pensez à effectuer votre réservation à l'avance grâce au comparateur d'eDreams. </p>",<h3>Quel est le prix moyen d'une location de voiture à Marseille ?</h3>,"<p>Le prix d'une location de voiture à Marseille dépend à la fois de la catégorie de véhicule choisi, de la période de location, des services additionnels (GPS, siège auto, deuxième conducteur, kilométrage, etc), de l'âge du conducteur principal et du lieu de prise en charge. Certains loueurs facturent en effet un supplément aéroport. Pour une location de voiture d'entrée de gamme avec kilométrage illimité, vous pouvez toutefois compter entre 15 et 20 € par jour en effectuant votre réservation à l'avance. </p>",<h3>Quel type de véhicule louer sur eDreams pour mon séjour à Marseille ? </h3>,"<p>Le moteur de recherche d'eDreams vous permet de réserver une voiture de location parmi différentes catégories de véhicules : mini, compacte, SUV, cabriolet, citadine, ou encore, minivan. Pour choisir, nous vous conseillons de prendre en compte vos besoins en terme de taille (nombre de passagers, volume des bagages, etc), votre itinéraire prévu, mais aussi vos préférences personnelles. Rouler sur la Corniche Kennedy en cabriolet est en effet une expérience exceptionnelle ! </p>",ok,983,https://www.edreams.fr/location-voiture/marseille/